{
  "$schema": "https://json-schema.org/draft/2020-12/schema",
  "$id": "https://github.com/Azure/git-ape/schemas/git-ape/requirements/v1.json",
  "title": "Git-Ape requirements.json (v1)",
  "description": "User requirements collected by the Requirements Gatherer agent. v1.0 accepts any object shape inside resources[].configuration; v1.1 will discriminate per ARM resource type.",
  "type": "object",
  "additionalProperties": false,
  "required": [
    "schemaVersion",
    "deploymentId",
    "timestamp",
    "source",
    "description"
  ],
  "properties": {
    "$schema": { "type": "string" },
    "schemaVersion": { "const": "1.0" },
    "deploymentId": {
      "type": "string",
      "pattern": "^[a-z0-9][a-z0-9._-]{0,89}$"
    },
    "timestamp": {
      "type": "string",
      "format": "date-time"
    },
    "source": {
      "type": "string",
      "enum": ["github-issue", "interactive", "import", "api"],
      "description": "How the requirements entered the system. The legacy 'issue-body' alias is migrated to 'github-issue'."
    },
    "mode": {
      "type": "string",
      "enum": ["interactive", "headless"]
    },
    "description": {
      "type": "string",
      "minLength": 1,
      "description": "Free-form natural-language deployment requirement."
    },
    "user": {
      "type": "string"
    },
    "type": {
      "type": "string",
      "enum": ["single-resource", "multi-resource", "import"]
    },
    "constraints": {
      "type": "object",
      "properties": {
        "region": {
          "type": "string",
          "pattern": "^[a-z][a-z0-9]{2,29}$"
        },
        "budget": {
          "type": "number",
          "minimum": 0
        },
        "securityLevel": {
          "type": "string",
          "enum": ["low", "medium", "high"]
        },
        "compliance": {
          "type": "array",
          "items": { "type": "string" },
          "uniqueItems": true
        }
      }
    },
    "resources": {
      "type": "array",
      "items": {
        "type": "object",
        "required": ["type"],
        "properties": {
          "type": {
            "type": "string",
            "pattern": "^[A-Za-z][A-Za-z0-9]+\\.[A-Za-z0-9]+/[A-Za-z0-9]+(/[A-Za-z0-9]+)*$"
          },
          "name": { "type": "string" },
          "displayName": { "type": "string" },
          "kind": { "type": "string" },
          "region": {
            "type": "string",
            "pattern": "^[a-z][a-z0-9]{2,29}$"
          },
          "resourceGroup": { "type": "string", "maxLength": 90 },
          "cafAbbreviation": {
            "type": "string",
            "pattern": "^[a-z]{1,8}$"
          },
          "sku": { "type": ["string", "object"] },
          "configuration": {
            "type": "object",
            "description": "Resource-type-specific configuration. v1.1 will discriminate this object on `type`."
          }
        }
      }
    },
    "dependencies": {
      "type": "array",
      "items": {
        "type": "object",
        "required": ["source", "target"],
        "properties": {
          "source": { "type": "string" },
          "target": { "type": "string" },
          "type": { "type": "string" }
        }
      }
    },
    "validation": {
      "type": "object",
      "properties": {
        "subscriptionAccess": { "type": "boolean" },
        "resourceGroupExists": { "type": "boolean" },
        "namesAvailable": { "type": "boolean" },
        "regionSupported": { "type": "boolean" },
        "quotaAvailable": { "type": "boolean" }
      }
    },
    "estimatedCost": {
      "type": "number",
      "minimum": 0
    },
    "requirements": {
      "type": "object",
      "description": "Structured requirements payload (legacy nested form). Fields here mirror top-level fields and are preserved for backward compatibility.",
      "properties": {
        "description": { "type": "string" },
        "constraints": { "type": "object" }
      }
    }
  }
}
